test_id,question,expected_answer,actual_answer,category,scale,type,conversation_id,input_tokens,output_tokens,total_tokens,run_sql_time,save_query_time,fuzzy_search_time,total_tool_time,execution_time_seconds,response_time,usage_snapshot,estimated_cost_usd,trace,overall_accuracy,summary_readability,summary_quality,data_accuracy,csv_score,geojson_score,accuracy_detail_score,accuracy_reason,key_information,Hallucination score,hallucination_reason,data_source_score,result_executive_summary_json,result_executive_summary_pdf
1,"Find me 90 The Terrace, Windsor","{ ""answer"": ""Found 90 The Terrace, Windsor NSW 2756.\n\n90 THE TERRACE WINDSOR NSW 2756\n\n- Suburb: WINDSOR 2756, NSW\n- GNAF ID: GANSW706348318"", ""result_csv"": ""55647695_cd659812.csv"", ""result_column_definition"": ""55647695_c120b7f3.json"", ""result_geojson"": ""55647695_731955e6.geojson"", ""note"": null, ""source"": [ { ""name"": ""PEXA Value Australia"", ""url"": ""https://value-australia.com.au/valuations-platform/"" } ] }","{'error': 'Agent execution error: An error occurred while processing your request. You can retry your request, or contact us through our help center at help.openai.com if the error persists. Please include the request ID req_1929be2fe43c49a78e48649f8e01c820 in your message.'}",Location,Single Property,1,,,,,,,,,,,,,,,,,,,,,,,,,,,
1,"Find me 90 The Terrace, Windsor","{ ""answer"": ""Found 90 The Terrace, Windsor NSW 2756.\n\n90 THE TERRACE WINDSOR NSW 2756\n\n- Suburb: WINDSOR 2756, NSW\n- GNAF ID: GANSW706348318"", ""result_csv"": ""55647695_cd659812.csv"", ""result_column_definition"": ""55647695_c120b7f3.json"", ""result_geojson"": ""55647695_731955e6.geojson"", ""note"": null, ""source"": [ { ""name"": ""PEXA Value Australia"", ""url"": ""https://value-australia.com.au/valuations-platform/"" } ] }","{'answer': 'Address found as:\n\n90 THE TERRACE WINDSOR NSW 2756\n\nProperty located and mapped for lending review.', 'artefacts': [{'geojson': {'filename': '3c19c800_e0cdbabf.geojson', 'layer_name': 'Subject Property', 'style': {'color': '#D32F2F', 'opacity': 1.0, 'line_width': 2.0, 'fill': None, 'point_radius': 8.0, 'z_index': 100}}, 'csv': {'filename': '3c19c800_96f055e3.csv', 'column_definition': [{'column_name': 'gnaf_id', 'header': 'GNAF ID', 'type': 'text', 'decimal': None}, {'column_name': 'address', 'header': 'Address', 'type': 'text', 'decimal': None}, {'column_name': 'street_address', 'header': 'Street Address', 'type': 'text', 'decimal': None}, {'column_name': 'suburb', 'header': 'Suburb', 'type': 'text', 'decimal': None}, {'column_name': 'postcode', 'header': 'Postcode', 'type': 'text', 'decimal': None}, {'column_name': 'state', 'header': 'State', 'type': 'text', 'decimal': None}]}, 'executive_summary': None}], 'note': None, 'source': [{'name': 'PEXA Value Australia', 'url': 'https://value-australia.com.au/valuations-platform/'}]}",Location,Single Property,1,conv_698a62cfde108190896fc1e61f3eab5106c382c9c8ca7ed7,677,637,72098,0.0821,0.2164,,0.2985,16.438,16.96,"{""requests"": 3, ""input_tokens"": 677, ""input_tokens_details"": {""cached_tokens"": 70784}, ""output_tokens"": 637, ""output_tokens_details"": {""reasoning_tokens"": 0}, ""total_tokens"": 72098, ""request_usage_entries"": [{""input_tokens"": 23439, ""output_tokens"": 93, ""total_tokens"": 23532, ""input_tokens_details"": {""cached_tokens"": 23424}, ""output_tokens_details"": {""reasoning_tokens"": 0}}, {""input_tokens"": 23720, ""output_tokens"": 269, ""total_tokens"": 23989, ""input_tokens_details"": {""cached_tokens"": 23424}, ""output_tokens_details"": {""reasoning_tokens"": 0}}, {""input_tokens"": 24302, ""output_tokens"": 275, ""total_tokens"": 24577, ""input_tokens_details"": {""cached_tokens"": 23936}, ""output_tokens_details"": {""reasoning_tokens"": 0}}], ""input_tokens_raw"": 71461, ""output_tokens_raw"": 637, ""total_tokens_raw"": 72098, ""input_tokens_cached"": 70784}",0.060732,"[{""type"": ""reasoning_item"", ""reasoning"": ""llm is thinking...""}, {""type"": ""tool_call"", ""tool"": ""run_sql"", ""call_id"": ""call_VCrigXrBmVdiZCZce9LtAHos"", ""arguments"": ""{\""sql\"":\""SELECT a.gnaf_id, a.address, a.street_address, a.suburb, a.postcode, a.state, a.geometry FROM pexava.address a WHERE a.address ILIKE '90 THE TERRACE WINDSOR NSW 2756' LIMIT 5;\"",\""limit\"":5,\""offset\"":0}""}, {""type"": ""tool_output"", ""tool"": null, ""call_id"": null, ""output"": ""SQL PREVIEW (not saved):\n\nMETADATA:\n- Requested: limit=5, offset=0\n- Total rows: 1\n- Showing: rows 1 to 1 of 1\n- Columns: 7 (gnaf_id, address, street_address, suburb, postcode, state, geometry)\n- Has geometry: yes\n\nPREVIEW (rows 1-1):\nNote: Geometry columns shown as <GeometryType SRID:####> for readability - not actual binary data.\n[('GANSW706348318', '90 THE TERRACE WINDSOR NSW 2756', '90 THE TERRACE', 'WINDSOR', '2756', 'NSW', '<Point SRID:7845>')]\n\nThis is a preview only - not saved or exported.\nUse save_query(sql, name) when ready to save and export."", ""has_error"": false}, {""type"": ""tool_call"", ""tool"": ""save_query"", ""call_id"": ""call_C5b5sSbFTzXm4PzCn84Ocora"", ""arguments"": ""{\""sql\"":\""SELECT \\n  a.gnaf_id,\\n  a.address,\\n  a.street_address,\\n  a.suburb,\\n  a.postcode,\\n  a.state,\\n  a.geometry\\nFROM pexava.address a\\nWHERE a.address ILIKE '90 THE TERRACE WINDSOR NSW 2756';\"",\""column_definition\"":\""[\\n  {\\\""column_name\\\"":\\\""gnaf_id\\\"",\\\""header\\\"":\\\""GNAF ID\\\"",\\\""type\\\"":\\\""text\\\""},\\n  {\\\""column_name\\\"":\\\""address\\\"",\\\""header\\\"":\\\""Address\\\"",\\\""type\\\"":\\\""text\\\""},\\n  {\\\""column_name\\\"":\\\""street_address\\\"",\\\""header\\\"":\\\""Street Address\\\"",\\\""type\\\"":\\\""text\\\""},\\n  {\\\""column_name\\\"":\\\""suburb\\\"",\\\""header\\\"":\\\""Suburb\\\"",\\\""type\\\"":\\\""text\\\""},\\n  {\\\""column_name\\\"":\\\""postcode\\\"",\\\""header\\\"":\\\""Postcode\\\"",\\\""type\\\"":\\\""text\\\""},\\n  {\\\""column_name\\\"":\\\""state\\\"",\\\""header\\\"":\\\""State\\\"",\\\""type\\\"":\\\""text\\\""}\\n]\"",\""name\"":\""address_lookup_90_the_terrace_windsor_2756\"",\""layer_name\"":\""Subject Property\"",\""style\"":\""{\\\""color\\\"":\\\""#D32F2F\\\"",\\\""opacity\\\"":1,\\\""line_width\\\"":2,\\\""point_radius\\\"":8,\\\""z_index\\\"":100}\""}""}, {""type"": ""tool_output"", ""tool"": null, ""call_id"": null, ""output"": ""Query 'address_lookup_90_the_terrace_windsor_2756' created and exported successfully.\n\nMETADATA:\n- Rows: 1\n- Columns: 7 (gnaf_id, address, street_address, suburb, postcode, state, geometry)\n- Has geometry: yes\n\nPREVIEW (first 5 rows):\nNote: Geometry columns shown as <GeometryType SRID:####> for readability - not actual binary data.\n[('GANSW706348318', '90 THE TERRACE WINDSOR NSW 2756', '90 THE TERRACE', 'WINDSOR', '2756', 'NSW', '<Point SRID:7845>')]\n\nEXPORTED FILES:\n- GeoJSON: 3c19c800_e0cdbabf.geojson\n- CSV: 3c19c800_96f055e3.csv\n\nUSE THESE IN YOUR RESPONSE:\nAdd a new item to the 'artefacts' array containing:\n  geojson:\n    filename: \""3c19c800_e0cdbabf.geojson\""\n    layer_name: \""Subject Property\""\n    style: {\""color\"": \""#D32F2F\"", \""opacity\"": 1, \""line_width\"": 2, \""point_radius\"": 8, \""z_index\"": 100}\n  csv:\n    filename: \""3c19c800_96f055e3.csv\""\n    column_definition: <the column_definition you provided>"", ""has_error"": false}, {""type"": ""message"", ""content"": ""{\""answer\"":\""Address found as:\\n\\n90 THE TERRACE WINDSOR NSW 2756\\n\\nProperty located and mapped for lending review.\"",\""artefacts\"":[{\""geojson\"":{\""filename\"":\""3c19c800_e0cdbabf.geojson\"",\""layer_name\"":\""Subject Property\"",\""style\"":{\""color\"":\""#D32F2F\"",\""opacity\"":1,\""line_width\"":2,\""fill\"":null,\""point_radius\"":8,\""z_index\"":100}},\""csv\"":{\""filename\"":\""3c19c800_96f055e3.csv\"",\""column_definition\"":[{\""column_name\"":\""gnaf_id\"",\""header\"":\""GNAF ID\"",\""type\"":\""text\"",\""decimal\"":null},{\""column_name\"":\""address\"",\""header\"":\""Address\"",\""type\"":\""text\"",\""decimal\"":null},{\""column_name\"":\""street_address\"",\""header\"":\""Street Address\"",\""type\"":\""text\"",\""decimal\"":null},{\""column_name\"":\""suburb\"",\""header\"":\""Suburb\"",\""type\"":\""text\"",\""decimal\"":null},{\""column_name\"":\""postcode\"",\""header\"":\""Postcode\"",\""type\"":\""text\"",\""decimal\"":null},{\""column_name\"":\""state\"",\""header\"":\""State\"",\""type\"":\""text\"",\""decimal\"":null}]},\""executive_summary\"":null}],\""note\"":null,\""source\"":[{\""name\"":\""PEXA Value Australia\"",\""url\"":\""https://value-australia.com.au/valuations-platform/\""}]}""}]",82,71,75,100,1,1,Readability: Bullet Points Present: 0; No Conclusion Words: 0; Fuzzy Match Highlighted: 1; No Strikethrough: 1; No Tool Mention: 1; Max Length: 1; No Technical Commentary: 1 | Quality: Semantic Similarity: 1; Length Similarity Match: 1; Language Alignment: 1; Key Factors: 0 | Data: Numbers: 1,"Summary Readability: (1) Bullet Points Present: 0 — the actual reply does not use bullet/numbered lists. (2) No Conclusion Words: 0 — it includes a concluding phrase 'mapped for lending review'. (3) Fuzzy Match Highlighted: 1 — no fuzzy-match note was needed/used, so per instructions return 1. (4) No Strikethrough: 1 — no strikethrough formatting appears. (5) No Tool Mention: 1 — the actual text does not reference tools or actions like 'checked with' or specific tool names. (6) Max Length: 1 — the actual response is well under 100 words. (7) No Technical Commentary: 1 — no technical IDs/columns/coordinates are present. Summary Quality: (1) Semantic Similarity: 1 — both convey that the address 90 THE TERRACE, WINDSOR NSW 2756 was found. (2) Length Similarity Match: 1 — lengths are similar. (3) Language Alignment: 1 — both are factual, terse, and formal. (4) Key Factors: 0 — the expected includes a GNAF ID and explicit suburb line which the actual omits. Data Accuracy: 1 — the key numeric/address information (street number, street, suburb, postcode) matches between expected and actual.",90 THE TERRACE WINDSOR NSW 2756; address found/mapped; expected also listed Suburb: WINDSOR 2756 NSW and GNAF ID: GANSW706348318 (GNAF ID missing from actual).,,,1,,
1,"Find me 90 The Terrace, Windsor","{ ""answer"": ""Found 90 The Terrace, Windsor NSW 2756.\n\n90 THE TERRACE WINDSOR NSW 2756\n\n- Suburb: WINDSOR 2756, NSW\n- GNAF ID: GANSW706348318"", ""result_csv"": ""55647695_cd659812.csv"", ""result_column_definition"": ""55647695_c120b7f3.json"", ""result_geojson"": ""55647695_731955e6.geojson"", ""note"": null, ""source"": [ { ""name"": ""PEXA Value Australia"", ""url"": ""https://value-australia.com.au/valuations-platform/"" } ] }","{'answer': 'Address found as:\n\n90 THE TERRACE WINDSOR NSW 2756\n\nProperty located and mapped for lending review. GNAF ID identified for downstream valuation and comparable analysis.', 'artefacts': [{'geojson': {'filename': 'f40fb97c_01065bdf.geojson', 'layer_name': 'Subject Property', 'style': {'color': '#ff3b30', 'opacity': 1.0, 'line_width': 2.0, 'fill': True, 'point_radius': 8.0, 'z_index': 1000}}, 'csv': {'filename': 'f40fb97c_d20729fd.csv', 'column_definition': [{'column_name': 'address', 'header': 'Address', 'type': 'text', 'decimal': None}, {'column_name': 'gnaf_id', 'header': 'GNAF ID', 'type': 'text', 'decimal': None}, {'column_name': 'suburb', 'header': 'Suburb', 'type': 'text', 'decimal': None}, {'column_name': 'state', 'header': 'State', 'type': 'text', 'decimal': None}]}, 'executive_summary': None}], 'note': None, 'source': [{'name': 'PEXA Value Australia', 'url': 'https://value-australia.com.au/valuations-platform/'}]}",Location,Single Property,1,conv_698a62fc7a348197b984a402af3fc24e008843d02080565b,24333,583,95700,0.0858,0.1812,,0.267,22.8189,24.22,"{""requests"": 4, ""input_tokens"": 24333, ""input_tokens_details"": {""cached_tokens"": 70784}, ""output_tokens"": 583, ""output_tokens_details"": {""reasoning_tokens"": 0}, ""total_tokens"": 95700, ""request_usage_entries"": [{""input_tokens"": 23439, ""output_tokens"": 72, ""total_tokens"": 23511, ""input_tokens_details"": {""cached_tokens"": 23424}, ""output_tokens_details"": {""reasoning_tokens"": 0}}, {""input_tokens"": 23568, ""output_tokens"": 72, ""total_tokens"": 23640, ""input_tokens_details"": {""cached_tokens"": 0}, ""output_tokens_details"": {""reasoning_tokens"": 0}}, {""input_tokens"": 23813, ""output_tokens"": 192, ""total_tokens"": 24005, ""input_tokens_details"": {""cached_tokens"": 23424}, ""output_tokens_details"": {""reasoning_tokens"": 0}}, {""input_tokens"": 24297, ""output_tokens"": 247, ""total_tokens"": 24544, ""input_tokens_details"": {""cached_tokens"": 23936}, ""output_tokens_details"": {""reasoning_tokens"": 0}}], ""input_tokens_raw"": 95117, ""output_tokens_raw"": 583, ""total_tokens_raw"": 95700, ""input_tokens_cached"": 70784}",0.060084,"[{""type"": ""reasoning_item"", ""reasoning"": ""llm is thinking...""}, {""type"": ""tool_call"", ""tool"": ""run_sql"", ""call_id"": ""call_H6WqVgLP9avvQMHRcnwAIddC"", ""arguments"": ""{\""sql\"":\""SELECT address, gnaf_id, suburb, postcode, geometry FROM pexava.property_title WHERE address ILIKE '90 THE TERRACE%WINDSOR%';\"",\""limit\"":5,\""offset\"":0}""}, {""type"": ""tool_output"", ""tool"": null, ""call_id"": null, ""output"": ""Error: SQL syntax error: column \""postcode\"" does not exist\nLINE 1: ...T COUNT(*) FROM (SELECT address, gnaf_id, suburb, postcode, ...\n                                                             ^\n\nFix the SQL and try again."", ""has_error"": true}, {""type"": ""reasoning_item"", ""reasoning"": ""llm is thinking...""}, {""type"": ""tool_call"", ""tool"": ""run_sql"", ""call_id"": ""call_2NxZHxWK0EJHfTpiadt6rDWS"", ""arguments"": ""{\""sql\"":\""SELECT address, gnaf_id, suburb, state, geometry FROM pexava.property_title WHERE address ILIKE '90 THE TERRACE%WINDSOR%';\"",\""limit\"":5,\""offset\"":0}""}, {""type"": ""tool_output"", ""tool"": null, ""call_id"": null, ""output"": ""SQL PREVIEW (not saved):\n\nMETADATA:\n- Requested: limit=5, offset=0\n- Total rows: 1\n- Showing: rows 1 to 1 of 1\n- Columns: 5 (address, gnaf_id, suburb, state, geometry)\n- Has geometry: yes\n\nPREVIEW (rows 1-1):\nNote: Geometry columns shown as <GeometryType SRID:####> for readability - not actual binary data.\n[('90 THE TERRACE WINDSOR NSW 2756', 'GANSW706348318', 'WINDSOR', 'NSW', '<Point SRID:7845>')]\n\nThis is a preview only - not saved or exported.\nUse save_query(sql, name) when ready to save and export."", ""has_error"": false}, {""type"": ""reasoning_item"", ""reasoning"": ""llm is thinking...""}, {""type"": ""tool_call"", ""tool"": ""save_query"", ""call_id"": ""call_BEMAQ5Bo5TCfz8d2Gp0x0v0c"", ""arguments"": ""{\""sql\"":\""SELECT address, gnaf_id, suburb, state, geometry FROM pexava.property_title WHERE address ILIKE '90 THE TERRACE%WINDSOR%';\"",\""column_definition\"":\""[{\\\""column_name\\\"":\\\""address\\\"",\\\""header\\\"":\\\""Address\\\"",\\\""type\\\"":\\\""text\\\""},{\\\""column_name\\\"":\\\""gnaf_id\\\"",\\\""header\\\"":\\\""GNAF ID\\\"",\\\""type\\\"":\\\""text\\\""},{\\\""column_name\\\"":\\\""suburb\\\"",\\\""header\\\"":\\\""Suburb\\\"",\\\""type\\\"":\\\""text\\\""},{\\\""column_name\\\"":\\\""state\\\"",\\\""header\\\"":\\\""State\\\"",\\\""type\\\"":\\\""text\\\""}]\"",\""name\"":\""address_lookup_90_the_terrace_windsor\"",\""layer_name\"":\""Subject Property\"",\""style\"":\""{\\\""color\\\"":\\\""#ff3b30\\\"",\\\""opacity\\\"":1,\\\""line_width\\\"":2,\\\""fill\\\"":true,\\\""point_radius\\\"":8,\\\""z_index\\\"":1000}\""}""}, {""type"": ""tool_output"", ""tool"": null, ""call_id"": null, ""output"": ""Query 'address_lookup_90_the_terrace_windsor' created and exported successfully.\n\nMETADATA:\n- Rows: 1\n- Columns: 5 (address, gnaf_id, suburb, state, geometry)\n- Has geometry: yes\n\nPREVIEW (first 5 rows):\nNote: Geometry columns shown as <GeometryType SRID:####> for readability - not actual binary data.\n[('90 THE TERRACE WINDSOR NSW 2756', 'GANSW706348318', 'WINDSOR', 'NSW', '<Point SRID:7845>')]\n\nEXPORTED FILES:\n- GeoJSON: f40fb97c_01065bdf.geojson\n- CSV: f40fb97c_d20729fd.csv\n\nUSE THESE IN YOUR RESPONSE:\nAdd a new item to the 'artefacts' array containing:\n  geojson:\n    filename: \""f40fb97c_01065bdf.geojson\""\n    layer_name: \""Subject Property\""\n    style: {\""color\"": \""#ff3b30\"", \""opacity\"": 1, \""line_width\"": 2, \""fill\"": true, \""point_radius\"": 8, \""z_index\"": 1000}\n  csv:\n    filename: \""f40fb97c_d20729fd.csv\""\n    column_definition: <the column_definition you provided>"", ""has_error"": false}, {""type"": ""message"", ""content"": ""{\""answer\"":\""Address found as:\\n\\n90 THE TERRACE WINDSOR NSW 2756\\n\\nProperty located and mapped for lending review. GNAF ID identified for downstream valuation and comparable analysis.\"",\""artefacts\"":[{\""geojson\"":{\""filename\"":\""f40fb97c_01065bdf.geojson\"",\""layer_name\"":\""Subject Property\"",\""style\"":{\""color\"":\""#ff3b30\"",\""opacity\"":1,\""line_width\"":2,\""fill\"":true,\""point_radius\"":8,\""z_index\"":1000}},\""csv\"":{\""filename\"":\""f40fb97c_d20729fd.csv\"",\""column_definition\"":[{\""column_name\"":\""address\"",\""header\"":\""Address\"",\""type\"":\""text\"",\""decimal\"":null},{\""column_name\"":\""gnaf_id\"",\""header\"":\""GNAF ID\"",\""type\"":\""text\"",\""decimal\"":null},{\""column_name\"":\""suburb\"",\""header\"":\""Suburb\"",\""type\"":\""text\"",\""decimal\"":null},{\""column_name\"":\""state\"",\""header\"":\""State\"",\""type\"":\""text\"",\""decimal\"":null}]},\""executive_summary\"":null}],\""note\"":null,\""source\"":[{\""name\"":\""PEXA Value Australia\"",\""url\"":\""https://value-australia.com.au/valuations-platform/\""}]}""}]",80,42,100,100,1,1,Readability: Bullet Points Present: 0; No Conclusion Words: 0; Fuzzy Match Highlighted: 1; No Strikethrough: 1; No Tool Mention: 0; Max Length: 1; No Technical Commentary: 0 | Quality: Semantic Similarity: 1; Length Similarity Match: 1; Language Alignment: 1; Key Factors: 1 | Data: Numbers: 1,"Summary Readability: 1) Bullet Points Present: 0 — actual uses prose, not bullet/numbered list. 2) No Conclusion Words: 0 — actual contains conclusion/action language (“mapped for lending review”). 3) Fuzzy Match Highlighted: 1 — actual does not indicate a fuzzy match; per instruction return 1 when no fuzzy match is used. 4) No Strikethrough: 1 — no strikethrough formatting present. 5) No Tool Mention: 0 — actual references processing actions (“mapped”, “identified for downstream valuation”), which count as tool/process mentions. 6) Max Length: 1 — actual is under 100 words. 7) No Technical Commentary: 0 — actual references technical term “GNAF ID” and downstream analysis. Summary Quality: 1) Semantic Similarity: 1 — actual conveys the same core message (address found and GNAF ID identified), though it omits the explicit GNAF ID value. 2) Length Similarity Match: 1 — lengths are similar (both very short). 3) Language Alignment: 1 — tone and formality are similar (concise factual statement). 4) Key Factors: 1 — both include the address and indicate a GNAF ID presence. Data Accuracy: 1) Numeric/key data match: 1 — the address and postcode (90 THE TERRACE, WINDSOR NSW 2756) match; although the actual omits the explicit GNAF ID string, the key numeric/location info is consistent.","90 THE TERRACE, WINDSOR NSW 2756; Suburb: WINDSOR 2756, NSW; GNAF ID present (expected value GANSW706348318 shown in expected; actual states a GNAF ID was identified but does not provide the string); property located/mapped for lending review.",,,1,,
